,doi,title,year,location,series,keyword_list,author_list,country
0,10.1145/3657054.3657252,Understanding the Ukrainian Migrants Challenges in the EU: A Topic Modeling Approach,2024,"Taipei, Taiwan",dg.o '24,"European countries, Migration challenges, Social media, Topic Modelling, Ukraine","['Nina Khairova', 'Nina Rizun', 'Charalampos Alexopoulos', 'Magdalena Ciesielska', 'Arsenii Lukashevskyi', 'Ivan Redozub']",Taiwan
1,10.1016/j.tele.2023.102073,Do personality traits influence the user’s behavioral intention to adopt and use Open Government Data (OGD)? An empirical investigation,2024,,,"Open Government Data, OGD, Personality traits, Technology adoption, UTAUT, HEXACO","['Nina Rizun', 'Charalampos Alexopoulos', 'Stuti Saxena', 'Fernando Kleiman', 'Ricardo Matheus']",
2,10.1145/3614321.3614345,Information scent and open government data (OGD) engagement: research agenda,2023,"Belo Horizonte, Brazil",ICEGOV '23,[],"['SAXENA S', 'Guilherme Wiedenhoft', 'Edimara Luciano', 'Charalampos Alexopoulos', 'Nina Rizun', 'Loukis Euripidis', 'RICARDO MATHEUS']",Brazil
3,10.1145/3598469.3598521,How do personality traits influence Open Government Data (OGD) adoption and usage? Investigating the indirect and moderating effects,2023,"Gda?sk, Poland",dg.o '23,"HEXACO, OGD, Open Government Data, Personality","['Nina Rizun', 'Charalampos Alexopoulos', 'Stuti Saxena', 'Fernando Kleiman', 'Ricardo Matheus']",Poland
4,10.1145/3598469.3598471,Application of Text Analytics in Public Service Co-Creation: Literature Review and Research Framework,2023,"Gda?sk, Poland",dg.o '23,"co-creation, literature review, natural language processing, public services, text analytics","['Nina Rizun', 'Aleksandra Revina', 'Noella Edelmann']",Poland
5,10.1016/j.telpol.2022.102316,Assessment of E-government inclusion policies toward seniors: A framework and case study,2022,,,"Digital inclusion, Seniors, Elders, Electronic government, Public policy, Assessment","['Magdalena Ciesielska', 'Nina Rizun', 'Jakub Chabik']",
